Project Name,Description,Location,Impact Metrics,Cost Per Ton (USD)
California Water Conservation,Distributing water-saving fixtures like low-flow faucets and showerheads,USA,Saves 1000 gallons of water,20.00
Indian Solar Energy,Renewable solar energy project,India,Generates clean energy,20.00
Brazilian Wind Farms,Development of wind farms,Brazil,Replaces fossil fuels,30.00
Indonesian Mangroves,Mangrove reforestation and restoration,Indonesia,Absorbs CO2e from the atmosphere,15.00
African Cookstove Project,Distributes efficient cookstoves,Africa,Reduces CO2e emissions by 2 tons,10.00
